{
  "schema": "sourcefold.occupation.v0",
  "id": "coc:occupation:shofer",
  "kind": "occupation",
  "name": {
    "ru": "Шофёр",
    "en": null
  },
  "group": "Водитель",
  "lovecraftian": false,
  "description": {
    "ru": "Профессиональный водитель может работать в организации, у частного лица или возить пассажиров и грузы на собственной машине.\nТаксисты трудятся в крупных и мелких компаниях, а некоторые занимаются частным извозом (в США для этого нужна лицензия). Компании такси обычно устроены так: водитель официально не состоит в штате, а отчисляет деньги за аренду машины и услуги диспетчера, остальной заработок оставляет себе. В каждом такси должен быть счётчик, который периодически проверяют городские службы. Для вождения такси, как правило, требуется специальное разрешение, при получении которого соискатель проходит проверку на благонадёжность.\nШофёров нанимают компании и частные лица, либо они работают в агентстве, где клиент может заказать машину с шофёром для отдельной поездки или на регулярной основе.",
    "en": null
  },
  "skill_points": {
    "raw": "ОБР × 2 + ЛВК × 2",
    "options": [
      [
        [
          "EDU",
          2
        ],
        [
          "DEX",
          2
        ]
      ]
    ]
  },
  "credit_rating": {
    "raw": "10–40",
    "min": 10,
    "max": 40
  },
  "contacts": "успешные предприниматели (и преступники), политики",
  "skills": [
    {
      "raw": "Внимание",
      "skill": "coc:skill:spot-hidden"
    },
    {
      "raw": "Вождение автомобиля",
      "skill": "coc:skill:drive-auto"
    },
    {
      "raw": "Механика",
      "skill": "coc:skill:mechanical-repair"
    },
    {
      "raw": "Ориентирование",
      "skill": "coc:skill:navigate"
    },
    {
      "raw": "Слух",
      "skill": "coc:skill:listen"
    },
    {
      "raw": "два социальных навыка (Запугивание, Красноречие, Обаяние или Убеждение)",
      "choice": {
        "count": 2,
        "of": [
          "coc:skill:intimidate",
          "coc:skill:fast-talk",
          "coc:skill:charm",
          "coc:skill:persuade"
        ]
      }
    },
    {
      "raw": "один любой другой навык в зависимости от специальности и эпохи",
      "choice": {
        "count": 1,
        "of": "any"
      }
    }
  ],
  "axes": {
    "era": [
      "any"
    ],
    "ruleset": "core"
  },
  "sources": [
    {
      "book_id": "investigator-handbook-ru",
      "physical_page": 69,
      "printed_page": 73,
      "method": "book_text",
      "verified": true
    }
  ],
  "quality": {
    "needs_review": false,
    "flags": [],
    "notes": null
  }
}
