{
  "schema": "sourcefold.occupation.v0",
  "id": "coc:occupation:teatralnyy-akter",
  "kind": "occupation",
  "name": {
    "ru": "Театральный актёр",
    "en": null
  },
  "group": "Актёр",
  "lovecraftian": false,
  "description": {
    "ru": "Как правило, это актёр театра или кино. Многие театральные актёры имеют классическое образование и смотрят свысока на коммерческую киноиндустрию. К концу XX века эта тенденция почти исчезла — теперь киноактёры пользуются неменьшим уважением и больше зарабатывают.\nВо всём мире люди с огромным интересом следят за киноиндустрией и кинозвёздами. Порой актёры буквально просыпаются знаменитыми, и многие из них ведут яркую светскую жизнь, постоянно мелькая в прессе.\nВ 1920-х центром театральной жизни США был Нью-Йорк, но и в других крупных городах имелись театры. Похожая ситуация сложилась в Англии, где театральные труппы гастролировали по всей стране, а самые яркие премьеры проходили в Лондоне. Гастролёры путешествовали на поезде. Они ставили как новые пьесы, так и Шекспира и другую классику. Некоторые труппы подолгу гастролировали за рубежом, доезжая до Канады, Гавайев, Австралии или Европы.\nС появлением звукового кино в конце 1920-х годов многие звёзды немых фильмов не сумели привыкнуть к переменам. Пантомима и гримасы уступили место более сдержанной игре. На смену Джону Гарфилду и Фрэнсису Бушмену пришли новые звёзды, такие как Гэри Купер и Джоан Кроуфорд.",
    "en": null
  },
  "skill_points": {
    "raw": "ОБР × 2 + НАР × 2",
    "options": [
      [
        [
          "EDU",
          2
        ],
        [
          "APP",
          2
        ]
      ]
    ]
  },
  "credit_rating": {
    "raw": "9–40",
    "min": 9,
    "max": 40
  },
  "contacts": "театральные круги, газетные критики, актёрская гильдия или профсоюз",
  "skills": [
    {
      "raw": "Ближний бой",
      "skill": "coc:skill:fighting"
    },
    {
      "raw": "Искусство/ремесло (актёрская игра)",
      "skill": "coc:skill:art-craft",
      "specialization": "Актёрская игра"
    },
    {
      "raw": "История",
      "skill": "coc:skill:history"
    },
    {
      "raw": "Маскировка",
      "skill": "coc:skill:disguise"
    },
    {
      "raw": "Психология",
      "skill": "coc:skill:psychology"
    },
    {
      "raw": "два социальных навыка (Запугивание, Красноречие, Обаяние или Убеждение)",
      "choice": {
        "count": 2,
        "of": [
          "coc:skill:intimidate",
          "coc:skill:fast-talk",
          "coc:skill:charm",
          "coc:skill:persuade"
        ]
      }
    },
    {
      "raw": "один любой другой навык в зависимости от специальности и эпохи",
      "choice": {
        "count": 1,
        "of": "any"
      }
    }
  ],
  "axes": {
    "era": [
      "any"
    ],
    "ruleset": "core"
  },
  "sources": [
    {
      "book_id": "investigator-handbook-ru",
      "physical_page": 66,
      "printed_page": 70,
      "method": "book_text",
      "verified": true
    }
  ],
  "quality": {
    "needs_review": false,
    "flags": [],
    "notes": null
  }
}
