{
  "schema": "sourcefold.occupation.v0",
  "id": "coc:occupation:dizayner",
  "kind": "occupation",
  "name": {
    "ru": "Дизайнер",
    "en": null
  },
  "group": null,
  "lovecraftian": false,
  "description": {
    "ru": "Дизайнеры нужны во многих сферах, от моды до производства мебели. Одни дизайнеры — «свободные художники», другие работают в дизайн-студиях, третьи — на предприятиях, где занимаются разработкой товаров, технологий, игр, графики и так далее.\nВыбранная область дизайна может влиять на список навыков сыщика — измените их, если потребуется.",
    "en": null
  },
  "skill_points": {
    "raw": "ОБР × 4",
    "options": [
      [
        [
          "EDU",
          4
        ]
      ]
    ]
  },
  "credit_rating": {
    "raw": "20–60",
    "min": 20,
    "max": 60
  },
  "contacts": "рекламщики, СМИ, мебельщики, архитектурные агентства и так далее",
  "skills": [
    {
      "raw": "Бухгалтерское дело",
      "skill": "coc:skill:accounting"
    },
    {
      "raw": "Внимание",
      "skill": "coc:skill:spot-hidden"
    },
    {
      "raw": "Искусство/ремесло (любое)",
      "skill": "coc:skill:art-craft",
      "specialization": "любое"
    },
    {
      "raw": "Искусство/ремесло (фотография)",
      "skill": "coc:skill:art-craft",
      "specialization": "Фотография"
    },
    {
      "raw": "Механика",
      "skill": "coc:skill:mechanical-repair"
    },
    {
      "raw": "Психология",
      "skill": "coc:skill:psychology"
    },
    {
      "raw": "Работа в библиотеке или Работа с компьютером",
      "choice": {
        "count": 1,
        "of": [
          "coc:skill:library-use",
          "coc:skill:computer-use"
        ]
      }
    },
    {
      "raw": "один любой другой навык в зависимости от личной специализации",
      "choice": {
        "count": 1,
        "of": "any"
      }
    }
  ],
  "axes": {
    "era": [
      "any"
    ],
    "ruleset": "core"
  },
  "sources": [
    {
      "book_id": "investigator-handbook-ru",
      "physical_page": 71,
      "printed_page": 75,
      "method": "book_text",
      "verified": true
    }
  ],
  "quality": {
    "needs_review": false,
    "flags": [],
    "notes": null
  }
}
