{
  "schema": "sourcefold.occupation.v0",
  "id": "coc:occupation:issledovatel",
  "kind": "occupation",
  "name": {
    "ru": "Исследователь",
    "en": null
  },
  "group": null,
  "lovecraftian": false,
  "description": {
    "ru": "В государственных учреждениях и частном секторе трудятся тысячи людей, занятых прикладными исследованиями: химики, фармацевты, геологи и многие другие. Одни исследователи почти не покидают своих кабинетов и лабораторий, другие проводят много времени в поле.\nПолевые исследователи — обычно опытные, самостоятельные и предприимчивые люди. Они работают в частных фирмах и университетах. Геологи ищут месторождения нефти по заказу нефтяных компаний, антропологи изучают дикарей в забытых уголках земного шара, археологи проводят годы в пустынях и джунглях, раскапывая сокровища древних цивилизаций и ведя переговоры с местными рабочими и властями.",
    "en": null
  },
  "skill_points": {
    "raw": "ОБР × 4",
    "options": [
      [
        [
          "EDU",
          4
        ]
      ]
    ]
  },
  "credit_rating": {
    "raw": "9–30",
    "min": 9,
    "max": 30
  },
  "contacts": "учёные и исследователи, крупные предприятия и корпорации, чиновники и местные жители в других странах",
  "skills": [
    {
      "raw": "Внимание",
      "skill": "coc:skill:spot-hidden"
    },
    {
      "raw": "Иностранный язык",
      "skill": "coc:skill:language-other"
    },
    {
      "raw": "История",
      "skill": "coc:skill:history"
    },
    {
      "raw": "Работа в библиотеке",
      "skill": "coc:skill:library-use"
    },
    {
      "raw": "один социальный навык (Запугивание, Красноречие, Обаяние или Убеждение)",
      "choice": {
        "count": 1,
        "of": [
          "coc:skill:intimidate",
          "coc:skill:fast-talk",
          "coc:skill:charm",
          "coc:skill:persuade"
        ]
      }
    },
    {
      "raw": "три области исследований",
      "choice": {
        "count": 3,
        "of": "any"
      }
    }
  ],
  "axes": {
    "era": [
      "any"
    ],
    "ruleset": "core"
  },
  "sources": [
    {
      "book_id": "investigator-handbook-ru",
      "physical_page": 73,
      "printed_page": 77,
      "method": "book_text",
      "verified": true
    }
  ],
  "quality": {
    "needs_review": false,
    "flags": [],
    "notes": null
  }
}
