{
  "schema": "sourcefold.occupation.v0",
  "id": "coc:occupation:brodyaga",
  "kind": "occupation",
  "name": {
    "ru": "Бродяга",
    "en": null
  },
  "group": null,
  "lovecraftian": false,
  "description": {
    "ru": "В отличие от тех, кто вынужден скитаться из-за бедности, бродяга сам выбрал свой путь. Причина может быть в его философских взглядах, социальных или экономических проблемах или в желании избавиться от социальных ограничений.\nБродяги иногда нанимаются на работу на несколько дней или даже месяцев. Однако при любых проблемах они снова отправляются в путь, ища одиночества, а не комфорта. Жизнь в дороге характерна для американцев, но её приверженцы есть везде, где это не слишком опасно.",
    "en": null
  },
  "skill_points": {
    "raw": "ОБР × 2 + НАР × 2, или ОБР × 2 + ЛВК × 2, или ОБР × 2 + СИЛ × 2",
    "options": [
      [
        [
          "EDU",
          2
        ],
        [
          "APP",
          2
        ]
      ],
      [
        [
          "EDU",
          2
        ],
        [
          "DEX",
          2
        ]
      ],
      [
        [
          "EDU",
          2
        ],
        [
          "STR",
          2
        ]
      ]
    ]
  },
  "credit_rating": {
    "raw": "0–5",
    "min": 0,
    "max": 5
  },
  "contacts": "другие бродяги и бездомные, пара знакомых железнодорожных сторожей, шапочные знакомства во многих городах",
  "skills": [
    {
      "raw": "Лазание",
      "skill": "coc:skill:climb"
    },
    {
      "raw": "Ориентирование",
      "skill": "coc:skill:navigate"
    },
    {
      "raw": "Прыжки",
      "skill": "coc:skill:jump"
    },
    {
      "raw": "Скрытность",
      "skill": "coc:skill:stealth"
    },
    {
      "raw": "Слух",
      "skill": "coc:skill:listen"
    },
    {
      "raw": "один социальный навык (Запугивание, Красноречие, Обаяние или Убеждение)",
      "choice": {
        "count": 1,
        "of": [
          "coc:skill:intimidate",
          "coc:skill:fast-talk",
          "coc:skill:charm",
          "coc:skill:persuade"
        ]
      }
    },
    {
      "raw": "два любых других навыка в зависимости от личности и эпохи",
      "choice": {
        "count": 2,
        "of": "any"
      }
    }
  ],
  "axes": {
    "era": [
      "any"
    ],
    "ruleset": "core"
  },
  "sources": [
    {
      "book_id": "investigator-handbook-ru",
      "physical_page": 68,
      "printed_page": 72,
      "method": "book_text",
      "verified": true
    }
  ],
  "quality": {
    "needs_review": false,
    "flags": [],
    "notes": null
  }
}
