{
  "schema": "sourcefold.occupation.v0",
  "id": "coc:occupation:grabitel-bankov",
  "kind": "occupation",
  "name": {
    "ru": "Грабитель банков",
    "en": null
  },
  "group": "Преступник",
  "lovecraftian": false,
  "description": {
    "ru": "Преступники бывают самые разные — всех оттенков серого. Одни в погоне за выгодой хватаются за любую подвернувшуюся работёнку, другие — опытные специалисты, заранее планирующие каждое преступление. К первой группе можно отнести головорезов и воришек всех мастей, ко второй — грабителей банков, угонщиков, фальшивомонетчиков и мошенников.\nПреступник может принадлежать к какой-нибудь банде или преступному клану, а может действовать в одиночку, лишь иногда объединяясь с коллегами, когда награда стоит усилий и риска. Вольные бандиты занимаются уличными ограблениями, налётами на магазины и вооружённым разбоем.\nБутлегеры, уличная шпана и головорезы — рядовые уголовного мира. Они работают на преступные организации и обычно принимают на себя удар вместо вышестоящих бандитов. Им платят за молчание и преданность.\nМошенники обычно мастерски умеют заговаривать зубы. Действуя в одиночку или группой, они втираются в доверие к состоятельным людям или организациям и вытягивают у них нажитые честным трудом сбережения. Их аферы бывают весьма сложными, с использованием подставных лиц и съёмных домов, а бывают простыми, требующими всего одного мошенника и нескольких минут.\nСкупщики краденого принимают ворованные вещи и продают их другим преступникам или ничего не подозревающим честным людям. В сущности, скупщик — это посредник между ворами и покупателями. Он либо берёт долю от прибыли, либо, чаще, покупает краденое за гроши.\nМастера подделок — истинные художники преступного мира. Они подделывают официальные документы, договоры и чеки, рисуют липовые подписи. Начинающие изготавливают поддельные паспорта для мелких преступников, а настоящие профи вытачивают печатные штампы для фальшивых банкнот.\nНаёмные убийцы — безжалостные ликвидаторы. Обычно их нанимают заказчики из других городов. Убийца приезжает, выполняет заказ и быстро исчезает. Ничего личного, просто бизнес. Зачастую это социопаты, неспособные сочувствовать другим людям. У некоторых есть собственный свод правил, которые они неукоснительно выполняют. При этом они могут жениться, заводить детей и в остальном вести себя как примерные граждане.\nКонтрабанда — всегда прибыльное и рискованное занятие. У контрабандиста обычно есть официальная работа (например, на морском судне, в авиации или в торговле), под прикрытием которой он возит нелегальные грузы.\nА уличная шпана — простые парни с окраин, мечтающие когда-нибудь стать настоящими гангстерами. Их умения ограничиваются угоном машин, магазинными кражами, уличным грабежом и взломом.",
    "en": null
  },
  "skill_points": {
    "raw": "ОБР × 2 + СИЛ × 2 или ОБР × 2 + ЛВК × 2",
    "options": [
      [
        [
          "EDU",
          2
        ],
        [
          "STR",
          2
        ]
      ],
      [
        [
          "EDU",
          2
        ],
        [
          "DEX",
          2
        ]
      ]
    ]
  },
  "credit_rating": {
    "raw": "5–75",
    "min": 5,
    "max": 75
  },
  "contacts": "другие члены банды (нынешние и бывшие), наёмные бандиты, мафия.",
  "skills": [
    {
      "raw": "Ближний бой",
      "skill": "coc:skill:fighting"
    },
    {
      "raw": "Взлом",
      "skill": "coc:skill:locksmith"
    },
    {
      "raw": "Вождение автомобиля",
      "skill": "coc:skill:drive-auto"
    },
    {
      "raw": "Запугивание",
      "skill": "coc:skill:intimidate"
    },
    {
      "raw": "Механика или Электрика",
      "choice": {
        "count": 1,
        "of": [
          "coc:skill:mechanical-repair",
          "coc:skill:electrical-repair"
        ]
      }
    },
    {
      "raw": "Стрельба",
      "skill": "coc:skill:firearms"
    },
    {
      "raw": "Управление тяжёлыми машинами",
      "skill": "coc:skill:heavy-machinery"
    },
    {
      "raw": "один любой другой навык в зависимости от специальности и эпохи",
      "choice": {
        "count": 1,
        "of": "any"
      }
    }
  ],
  "axes": {
    "era": [
      "any"
    ],
    "ruleset": "core"
  },
  "sources": [
    {
      "book_id": "investigator-handbook-ru",
      "physical_page": 80,
      "printed_page": 84,
      "method": "book_text",
      "verified": true
    }
  ],
  "quality": {
    "needs_review": false,
    "flags": [],
    "notes": null
  }
}
