{
  "schema": "sourcefold.occupation.v0",
  "id": "coc:occupation:puteshestvennik",
  "kind": "occupation",
  "name": {
    "ru": "Путешественник",
    "en": null
  },
  "group": null,
  "lovecraftian": false,
  "description": {
    "ru": "В начале XX века на карте Земли ещё оставались белые пятна, и некоторые делали карьеру на их исследовании. Научные гранты, частные пожертвования, контракты с музеями, а также гонорары за статьи для газет и журналов, книги и кинофильмы обеспечивали путешественникам безбедную жизнь.\nВ Африке до сих пор есть неисследованные территории, как и в верховьях Амазонки в Южной Америке, в Большой Австралийской пустыне, Сахаре, Аравийской пустыне и Средней Азии. Хотя экспедиции уже покорили Северный и Южный полюса, огромные пространства вокруг них малоизучены.",
    "en": null
  },
  "skill_points": {
    "raw": "ОБР × 2 + НАР × 2, или ОБР × 2 + ЛВК × 2, или ОБР × 2 + СИЛ × 2",
    "options": [
      [
        [
          "EDU",
          2
        ],
        [
          "APP",
          2
        ]
      ],
      [
        [
          "EDU",
          2
        ],
        [
          "DEX",
          2
        ]
      ],
      [
        [
          "EDU",
          2
        ],
        [
          "STR",
          2
        ]
      ]
    ]
  },
  "credit_rating": {
    "raw": "55–80",
    "min": 55,
    "max": 80
  },
  "contacts": "крупные библиотеки, университеты, музеи, богатые покровители, другие путешественники, издатели, иностранные чиновники, туземные племена.",
  "skills": [
    {
      "raw": "Выживание",
      "skill": "coc:skill:survival"
    },
    {
      "raw": "Естествознание",
      "skill": "coc:skill:natural-world"
    },
    {
      "raw": "Иностранный язык",
      "skill": "coc:skill:language-other"
    },
    {
      "raw": "История",
      "skill": "coc:skill:history"
    },
    {
      "raw": "Лазание или Плавание",
      "choice": {
        "count": 1,
        "of": [
          "coc:skill:climb",
          "coc:skill:swim"
        ]
      }
    },
    {
      "raw": "Ориентирование",
      "skill": "coc:skill:navigate"
    },
    {
      "raw": "Прыжки",
      "skill": "coc:skill:jump"
    },
    {
      "raw": "Стрельба",
      "skill": "coc:skill:firearms"
    }
  ],
  "axes": {
    "era": [
      "1920s"
    ],
    "ruleset": "core"
  },
  "sources": [
    {
      "book_id": "investigator-handbook-ru",
      "physical_page": 82,
      "printed_page": 86,
      "method": "book_text",
      "verified": true
    }
  ],
  "quality": {
    "needs_review": false,
    "flags": [],
    "notes": null
  }
}
