{
  "schema": "sourcefold.occupation.v0",
  "id": "coc:occupation:sudya",
  "kind": "occupation",
  "name": {
    "ru": "Судья",
    "en": null
  },
  "group": null,
  "lovecraftian": false,
  "description": {
    "ru": "Чиновник, председательствующий на судебных процессах, один или в составе группы присяжных. Судей назначают или избирают, иногда на определённый срок, а иногда пожизненно. Присяжных выбирают из тех, у кого нет юридического опыта, но большинство судей — профессиональные юристы с лицензией, заседают ли они в городке на дальнем Западе или в Верховном суде.",
    "en": null
  },
  "skill_points": {
    "raw": "ОБР × 4",
    "options": [
      [
        [
          "EDU",
          4
        ]
      ]
    ]
  },
  "credit_rating": {
    "raw": "50–80",
    "min": 50,
    "max": 80
  },
  "contacts": "юристы, возможно мафия.",
  "skills": [
    {
      "raw": "Запугивание",
      "skill": "coc:skill:intimidate"
    },
    {
      "raw": "История",
      "skill": "coc:skill:history"
    },
    {
      "raw": "Психология",
      "skill": "coc:skill:psychology"
    },
    {
      "raw": "Работа в библиотеке",
      "skill": "coc:skill:library-use"
    },
    {
      "raw": "Родной язык",
      "skill": "coc:skill:language-own"
    },
    {
      "raw": "Слух",
      "skill": "coc:skill:listen"
    },
    {
      "raw": "Убеждение",
      "skill": "coc:skill:persuade"
    },
    {
      "raw": "Юриспруденция",
      "skill": "coc:skill:law"
    }
  ],
  "axes": {
    "era": [
      "any"
    ],
    "ruleset": "core"
  },
  "sources": [
    {
      "book_id": "investigator-handbook-ru",
      "physical_page": 85,
      "printed_page": 89,
      "method": "book_text",
      "verified": true
    }
  ],
  "quality": {
    "needs_review": false,
    "flags": [],
    "notes": null
  }
}
