{
  "schema": "sourcefold.occupation.v0",
  "id": "coc:occupation:klerk-mladshiy-spetsialist",
  "kind": "occupation",
  "name": {
    "ru": "Клерк (младший специалист)",
    "en": null
  },
  "group": "Служащий",
  "lovecraftian": false,
  "description": {
    "ru": "Это занятие охватывает широкий спектр профессий, от мелкого клерка до руководителя среднего или высшего звена. Служащие работают как в небольших и средних местных компаниях, так и в крупных международных корпорациях.\nКлерки получают мало и занимаются тяжёлой монотонной работой, но те, кто хорошо себя проявит, могут надеяться на повышение. У руководителей среднего и высшего звена зарплата куда выше, при этом у них больше ответственности и возможности влиять на работу предприятия. Среди служащих большинство семейных, хотя есть и холостяки.",
    "en": null
  },
  "skill_points": {
    "raw": "ОБР × 4",
    "options": [
      [
        [
          "EDU",
          4
        ]
      ]
    ]
  },
  "credit_rating": {
    "raw": "9–20",
    "min": 9,
    "max": 20
  },
  "contacts": "другие офисные работники.",
  "skills": [
    {
      "raw": "Бухгалтерское дело",
      "skill": "coc:skill:accounting"
    },
    {
      "raw": "Работа в библиотеке или Работа с компьютером",
      "choice": {
        "count": 1,
        "of": [
          "coc:skill:library-use",
          "coc:skill:computer-use"
        ]
      }
    },
    {
      "raw": "Слух",
      "skill": "coc:skill:listen"
    },
    {
      "raw": "Юриспруденция",
      "skill": "coc:skill:law"
    },
    {
      "raw": "Язык (родной или иностранный)",
      "choice": {
        "count": 1,
        "of": [
          "coc:skill:language-own",
          "coc:skill:language-other"
        ]
      }
    },
    {
      "raw": "один социальный навык (Запугивание, Красноречие, Обаяние или Убеждение)",
      "choice": {
        "count": 1,
        "of": [
          "coc:skill:intimidate",
          "coc:skill:fast-talk",
          "coc:skill:charm",
          "coc:skill:persuade"
        ]
      }
    },
    {
      "raw": "два любых других навыка в зависимости от специальности и эпохи",
      "choice": {
        "count": 2,
        "of": "any"
      }
    }
  ],
  "axes": {
    "era": [
      "any"
    ],
    "ruleset": "core"
  },
  "sources": [
    {
      "book_id": "investigator-handbook-ru",
      "physical_page": 84,
      "printed_page": 88,
      "method": "book_text",
      "verified": true
    }
  ],
  "quality": {
    "needs_review": false,
    "flags": [],
    "notes": null
  }
}
