{
  "schema": "sourcefold.occupation.v0",
  "id": "coc:occupation:pozharnyy",
  "kind": "occupation",
  "name": {
    "ru": "Пожарный",
    "en": null
  },
  "group": null,
  "lovecraftian": false,
  "description": {
    "ru": "Пожарные — сотрудники государственной службы тушения пожаров, работающие посменно круглые сутки. Несколько дней подряд они едят, спят и отдыхают, не покидая депо. В США пожарная охрана организована на военный образец, её сотрудник может получить звание лейтенанта, капитана или комиссара пожарной службы.",
    "en": null
  },
  "skill_points": {
    "raw": "ОБР × 2 + ЛВК × 2 или ОБР × 2 + СИЛ × 2",
    "options": [
      [
        [
          "EDU",
          2
        ],
        [
          "DEX",
          2
        ]
      ],
      [
        [
          "EDU",
          2
        ],
        [
          "STR",
          2
        ]
      ]
    ]
  },
  "credit_rating": {
    "raw": "9–30",
    "min": 9,
    "max": 30
  },
  "contacts": "другие работники городских служб, врачи, полиция.",
  "skills": [
    {
      "raw": "Вождение автомобиля",
      "skill": "coc:skill:drive-auto"
    },
    {
      "raw": "Лазание",
      "skill": "coc:skill:climb"
    },
    {
      "raw": "Метание",
      "skill": "coc:skill:throw"
    },
    {
      "raw": "Механика",
      "skill": "coc:skill:mechanical-repair"
    },
    {
      "raw": "Первая помощь",
      "skill": "coc:skill:first-aid"
    },
    {
      "raw": "Прыжки",
      "skill": "coc:skill:jump"
    },
    {
      "raw": "Уклонение",
      "skill": "coc:skill:dodge"
    },
    {
      "raw": "Управление тяжёлыми машинами",
      "skill": "coc:skill:heavy-machinery"
    }
  ],
  "axes": {
    "era": [
      "any"
    ],
    "ruleset": "core"
  },
  "sources": [
    {
      "book_id": "investigator-handbook-ru",
      "physical_page": 78,
      "printed_page": 82,
      "method": "book_text",
      "verified": true
    }
  ],
  "quality": {
    "needs_review": false,
    "flags": [],
    "notes": null
  }
}
