{
  "schema": "sourcefold.occupation.v0",
  "id": "coc:occupation:profsoyuznyy-aktivist",
  "kind": "occupation",
  "name": {
    "ru": "Профсоюзный активист",
    "en": null
  },
  "group": null,
  "lovecraftian": false,
  "description": {
    "ru": "Как правило, это хорошие организаторы и руководители, а иногда мечтатели или бунтари, преследующие свои личные цели. Обычно они друзья рабочим и враги начальству. Профсоюзы существуют во всех сферах, от строительства до киноиндустрии.\nВ начале XX века руководители профсоюзов оказались под прицелом сразу нескольких сил: крупных корпораций, стремившихся их уничтожить, политиков, которые их то поддерживали, то осуждали, коммунистов с социалистами, пытавшихся внедриться в их ряды, и мафии, пытавшейся их захватить.",
    "en": null
  },
  "skill_points": {
    "raw": "ОБР × 4",
    "options": [
      [
        [
          "EDU",
          4
        ]
      ]
    ]
  },
  "credit_rating": {
    "raw": "5–30",
    "min": 5,
    "max": 30
  },
  "contacts": "другие профсоюзные лидеры и активисты, политические союзники, возможно мафия. В 1920-х также социалисты, коммунисты и революционеры-анархисты.",
  "skills": [
    {
      "raw": "Ближний бой (драка)",
      "skill": "coc:skill:fighting",
      "specialization": "Драка"
    },
    {
      "raw": "Бухгалтерское дело",
      "skill": "coc:skill:accounting"
    },
    {
      "raw": "Психология",
      "skill": "coc:skill:psychology"
    },
    {
      "raw": "Слух",
      "skill": "coc:skill:listen"
    },
    {
      "raw": "Управление тяжёлыми машинами",
      "skill": "coc:skill:heavy-machinery"
    },
    {
      "raw": "Юриспруденция",
      "skill": "coc:skill:law"
    },
    {
      "raw": "два социальных навыка (Запугивание, Красноречие, Обаяние или Убеждение)",
      "choice": {
        "count": 2,
        "of": [
          "coc:skill:intimidate",
          "coc:skill:fast-talk",
          "coc:skill:charm",
          "coc:skill:persuade"
        ]
      }
    }
  ],
  "axes": {
    "era": [
      "any"
    ],
    "ruleset": "core"
  },
  "sources": [
    {
      "book_id": "investigator-handbook-ru",
      "physical_page": 81,
      "printed_page": 85,
      "method": "book_text",
      "verified": true
    }
  ],
  "quality": {
    "needs_review": false,
    "flags": [],
    "notes": null
  }
}
