{
  "schema": "sourcefold.occupation.v0",
  "id": "coc:occupation:psikholog-psikhoanalitik",
  "kind": "occupation",
  "name": {
    "ru": "Психолог/психоаналитик",
    "en": null
  },
  "group": null,
  "lovecraftian": false,
  "description": {
    "ru": "Большинству известны только психологи-консультанты и психотерапевты, но это лишь одна из отраслей психологии. Существуют, например, специалисты по психологии труда, работающие с предприятиями и организациями, а также учёные и преподаватели психологии.\nКлинические психологи работают с пациентами, применяя разные терапевтические методы и подходы. Не забывайте о разнице между психологом и врачом-психиатром.\nВ 1920-х изучение поведения человека только начиналось и в основном представляло собой фрейдистский психоанализ.",
    "en": null
  },
  "skill_points": {
    "raw": "ОБР × 4",
    "options": [
      [
        [
          "EDU",
          4
        ]
      ]
    ]
  },
  "credit_rating": {
    "raw": "10–40",
    "min": 10,
    "max": 40
  },
  "contacts": "сообщество психологов, пациенты.",
  "skills": [
    {
      "raw": "Бухгалтерское дело",
      "skill": "coc:skill:accounting"
    },
    {
      "raw": "Психоанализ",
      "skill": "coc:skill:psychoanalysis"
    },
    {
      "raw": "Психология",
      "skill": "coc:skill:psychology"
    },
    {
      "raw": "Работа в библиотеке",
      "skill": "coc:skill:library-use"
    },
    {
      "raw": "Слух",
      "skill": "coc:skill:listen"
    },
    {
      "raw": "Убеждение",
      "skill": "coc:skill:persuade"
    },
    {
      "raw": "два любых других навыка в зависимости от личных и профессиональных интересов",
      "choice": {
        "count": 2,
        "of": "any"
      }
    }
  ],
  "axes": {
    "era": [
      "any"
    ],
    "ruleset": "core"
  },
  "sources": [
    {
      "book_id": "investigator-handbook-ru",
      "physical_page": 82,
      "printed_page": 86,
      "method": "book_text",
      "verified": true
    }
  ],
  "quality": {
    "needs_review": false,
    "flags": [],
    "notes": null
  }
}
